{
  "$schema": "https://json-schema.org/draft/2020-12/schema",
  "$id": "https://schemas.twalk.dev/cloudevents/v1/inbound.message.received.schema.json",
  "title": "fr.linagora.twalk.inbound.message.received.v1",
  "description": "A message received from an external messaging network, decrypted by the Sensor and normalized as a CloudEvents 1.0 envelope. Produced by the Sensor after successful Megolm decryption of an m.room.message event in a Matrix portal room. Consumed by Hermes personas subscribed to the inbound.message.received.* subject on NATS JetStream.",
  "type": "object",
  "required": [
    "specversion",
    "id",
    "source",
    "type",
    "time",
    "subject",
    "datacontenttype",
    "network",
    "consent",
    "data"
  ],
  "additionalProperties": false,
  "properties": {
    "specversion": {
      "type": "string",
      "const": "1.0",
      "description": "CloudEvents specification version. Fixed to 1.0 for all Twalk v1 events."
    },
    "id": {
      "type": "string",
      "pattern": "^[a-f0-9]{64}$",
      "description": "Deterministic identifier computed as sha256(matrix_event_id + ':' + matrix_room_id). Ensures idempotent replay: the same underlying Matrix event always produces the same CloudEvents id, so consumers can deduplicate safely across bus resynchronizations."
    },
    "source": {
      "type": "string",
      "format": "uri-reference",
      "pattern": "^matrix://[^/]+/![A-Za-z0-9]+:[^/]+$",
      "description": "URI identifying the Matrix room where the event originated. Format: matrix://<homeserver>/<room_id>. The homeserver is the Synapse instance operated by Twalk; the room_id is the portal room maintained by the Mautrix bridge.",
      "examples": [
        "matrix://matrix.example.com/!abcXYZ123:example.com"
      ]
    },
    "type": {
      "type": "string",
      "const": "fr.linagora.twalk.inbound.message.received.v1",
      "description": "CloudEvents type. Reverse-DNS convention with an explicit version suffix. Any breaking change to this schema requires incrementing the suffix (v2, v3, ...) rather than mutating v1."
    },
    "time": {
      "type": "string",
      "format": "date-time",
      "description": "RFC 3339 timestamp of when the Sensor produced the event, not the original network timestamp. The original network timestamp is preserved in data.network_timestamp when available."
    },
    "subject": {
      "type": "string",
      "pattern": "^@[a-zA-Z0-9._=/+-]+:[^/]+$",
      "description": "Matrix user ID of the observed sender, as materialized by the bridge (e.g. @whatsapp_33612345678:example.com). Used for routing and for consent evaluation.",
      "examples": [
        "@whatsapp_33612345678:example.com",
        "@telegram_987654321:example.com"
      ]
    },
    "datacontenttype": {
      "type": "string",
      "const": "application/json",
      "description": "Fixed to application/json for all Twalk v1 events. Binary payloads (images, files) are referenced by URL in data.attachments and stored separately in Matrix media storage."
    },
    "dataschema": {
      "type": "string",
      "format": "uri",
      "description": "Optional URI pointing back to this JSON Schema. Recommended for third-party consumers that validate events dynamically.",
      "examples": [
        "https://schemas.twalk.dev/cloudevents/v1/inbound.message.received.schema.json"
      ]
    },
    "traceparent": {
      "type": "string",
      "pattern": "^[0-9a-f]{2}-[0-9a-f]{32}-[0-9a-f]{16}-[0-9a-f]{2}$",
      "description": "Optional W3C Trace Context traceparent header. Enables distributed tracing across Sensor, NATS, Hermes and downstream services without mandating a specific tracing backend.",
      "examples": [
        "00-4bf92f3577b34da6a3ce929d0e0e4736-00f067aa0ba902b7-01"
      ]
    },
    "network": {
      "type": "string",
      "enum": ["whatsapp", "telegram", "signal", "discord", "sms", "matrix"],
      "description": "Twalk extension. Identifies the external network the message originated from, as the user experiences it; transport bridges (e.g. mautrix-gmessages) are never network values. The value matrix is native Matrix traffic: a room with no m.bridge state event and no ghost-prefixed sender, reached through the user's own Matrix account instead of through a bridge (see ADR 0009). Enables server-side filtering on NATS without deserializing the data payload."
    },
    "consent": {
      "type": "string",
      "enum": ["granted", "pending", "revoked"],
      "description": "Twalk extension. Current consent state of the sender's data-processing agreement, as tracked by the Companion Gateway, the single writer of consent state. Personas MUST refuse to process events where consent is not 'granted', unless they are explicitly authorized to handle consent-management workflows."
    },
    "data": {
      "type": "object",
      "required": ["body", "format", "reply_to", "attachments", "contact"],
      "additionalProperties": false,
      "properties": {
        "body": {
          "type": "string",
          "maxLength": 65536,
          "description": "The message content in its canonical text form. For messages with rich formatting, the plain-text fallback."
        },
        "format": {
          "type": "string",
          "enum": ["text/plain", "text/markdown", "text/html"],
          "description": "Content type of the body field. text/plain is the default and safest; text/html is only used when the source network provided HTML-formatted content."
        },
        "reply_to": {
          "oneOf": [
            {
              "type": "null"
            },
            {
              "type": "object",
              "required": ["matrix_event_id", "excerpt"],
              "additionalProperties": false,
              "properties": {
                "matrix_event_id": {
                  "type": "string",
                  "pattern": "^\\$[A-Za-z0-9_-]+$",
                  "description": "The Matrix event ID of the message being replied to."
                },
                "excerpt": {
                  "type": "string",
                  "maxLength": 512,
                  "description": "A short excerpt of the replied-to message for context, so consumers do not need to look it up to reason about the reply."
                }
              }
            }
          ],
          "description": "If the message is a reply to a previous one, structured reference to the parent. Null otherwise."
        },
        "attachments": {
          "type": "array",
          "maxItems": 16,
          "items": {
            "type": "object",
            "required": ["kind", "mxc_uri", "mime_type", "size_bytes"],
            "additionalProperties": false,
            "properties": {
              "kind": {
                "type": "string",
                "enum": ["image", "video", "audio", "file", "sticker", "location"],
                "description": "Coarse-grained category of the attachment."
              },
              "mxc_uri": {
                "type": "string",
                "pattern": "^mxc://[^/]+/[A-Za-z0-9]+$",
                "description": "Matrix content URI, resolvable via the homeserver media API."
              },
              "mime_type": {
                "type": "string",
                "pattern": "^[a-z]+/[a-zA-Z0-9.+-]+$",
                "description": "IANA media type of the attachment."
              },
              "size_bytes": {
                "type": "integer",
                "minimum": 0,
                "description": "Attachment size in bytes."
              },
              "caption": {
                "type": "string",
                "maxLength": 1024,
                "description": "Optional caption provided with the attachment."
              },
              "dimensions": {
                "type": "object",
                "required": ["width", "height"],
                "additionalProperties": false,
                "properties": {
                  "width": { "type": "integer", "minimum": 1 },
                  "height": { "type": "integer", "minimum": 1 }
                },
                "description": "Pixel dimensions for image and video attachments."
              },
              "duration_ms": {
                "type": "integer",
                "minimum": 0,
                "description": "Duration in milliseconds for audio and video attachments."
              },
              "encryption": {
                "type": "object",
                "required": ["key", "iv", "hashes", "v"],
                "additionalProperties": false,
                "properties": {
                  "key": {
                    "type": "object",
                    "required": ["kty", "key_ops", "alg", "k", "ext"],
                    "additionalProperties": false,
                    "properties": {
                      "kty": {
                        "type": "string",
                        "const": "oct",
                        "description": "JSON Web Key type. Always oct (a symmetric octet sequence) for Matrix attachment encryption."
                      },
                      "key_ops": {
                        "type": "array",
                        "uniqueItems": true,
                        "items": { "type": "string" },
                        "allOf": [
                          { "contains": { "const": "encrypt" } },
                          { "contains": { "const": "decrypt" } }
                        ],
                        "description": "Permitted key operations. Must contain at least encrypt and decrypt, per the Matrix EncryptedFile definition. Order is not significant, and the specification permits further operations, so consumers test for membership rather than comparing the whole array."
                      },
                      "alg": {
                        "type": "string",
                        "const": "A256CTR",
                        "description": "Key algorithm. Always A256CTR (AES-256 in counter mode) for version v2 attachment encryption."
                      },
                      "k": {
                        "type": "string",
                        "pattern": "^[A-Za-z0-9_-]{43}$",
                        "description": "The 256-bit AES key, URL-safe unpadded base64. This is decryption material for the user's own media: consumers MUST keep it inside the user's infrastructure and MUST NOT log it."
                      },
                      "ext": {
                        "type": "boolean",
                        "const": true,
                        "description": "JSON Web Key extractability flag. Always true, so the key can be imported by a consumer's crypto implementation."
                      }
                    },
                    "description": "The AES key as a JSON Web Key, exactly as carried by the Matrix event."
                  },
                  "iv": {
                    "type": "string",
                    "pattern": "^[A-Za-z0-9+/]{22}$",
                    "description": "The 128-bit unique counter block used by AES-CTR, standard-alphabet unpadded base64 (22 characters). Note the alphabet differs from key.k, which the Matrix specification encodes URL-safe."
                  },
                  "hashes": {
                    "type": "object",
                    "required": ["sha256"],
                    "additionalProperties": false,
                    "properties": {
                      "sha256": {
                        "type": "string",
                        "pattern": "^[A-Za-z0-9+/]{43}$",
                        "description": "SHA-256 digest of the ciphertext, standard-alphabet unpadded base64 (43 characters). Consumers MUST verify it before decrypting: it is what stops the homeserver from substituting the media bytes."
                      }
                    },
                    "description": "Digests of the ciphertext, keyed by algorithm. The Matrix specification types this as an open map and only recommends sha256; the contract carries sha256 and nothing else, so every consumer has exactly one digest to verify and one algorithm to implement."
                  },
                  "v": {
                    "type": "string",
                    "const": "v2",
                    "description": "Version of the attachment encryption scheme. v2 is the only version the Matrix specification defines; material from the pre-specification v1 scheme is not usable by consumers and is not published."
                  }
                },
                "description": "Optional decryption material for an attachment whose ciphertext is what mxc_uri resolves to. Mirrors the Matrix EncryptedFile object (key, iv, hashes, v) defined under 'Sending encrypted attachments' in the client-server specification, minus its url field, which mxc_uri already carries, and minus a mimetype, which the specification keeps in info and the contract keeps in mime_type. Present when the media itself is encrypted, which is the normal case in an end-to-end encrypted room and therefore in every bridge portal room; absent for media served in the clear. Producers re-serialize the values in the canonical encodings below rather than copying the sender's JSON through, so consumers handle exactly one encoding; a producer that cannot fill this object completely (an unsupported protocol version, or no sha256 digest) publishes the attachment without it rather than publishing unusable material. Either way the message is delivered and never silently dropped, but without this object a consumer can fetch the bytes and not read them."
              }
            }
          },
          "description": "Ordered list of attachments carried by the message. Only references and decryption material ever transit the bus; the bytes stay in Matrix media storage."
        },
        "contact": {
          "type": "object",
          "required": ["display_name"],
          "additionalProperties": false,
          "properties": {
            "display_name": {
              "type": "string",
              "maxLength": 256,
              "description": "Human-readable display name of the sender, as known to the recipient."
            },
            "network_identifier": {
              "type": "string",
              "maxLength": 256,
              "description": "Optional native network identifier (e.g. phone number for WhatsApp, username for Telegram). Only populated when consent state allows it."
            },
            "avatar_mxc_uri": {
              "type": "string",
              "pattern": "^mxc://[^/]+/[A-Za-z0-9]+$",
              "description": "Optional Matrix content URI for the contact's avatar."
            }
          },
          "description": "Structured information about the sender, resolved by Sensor from the Matrix membership state and bridge metadata."
        },
        "network_timestamp": {
          "type": "string",
          "format": "date-time",
          "description": "Optional RFC 3339 timestamp of the original event as reported by the source network, when the bridge provides it. Distinct from the top-level 'time' attribute, which is the Sensor's own timestamp."
        },
        "thread_root": {
          "type": "string",
          "pattern": "^\\$[A-Za-z0-9_-]+$",
          "description": "Optional Matrix event ID of the thread root, if the message is part of a Matrix thread."
        }
      }
    }
  }
}
